{
  "schemaVersion": "codex-model-catalog-v1",
  "catalogRevision": "125b9437e38f83e04cb10996fc70d3ab44c32082009b8e897cb08bb340b13187",
  "workerId": "ax42-01",
  "codexVersion": "0.145.0",
  "generatedAt": "2026-07-31T00:00:00Z",
  "models": [
    {
      "modelId": "gpt-5.6-sol",
      "displayName": "GPT-5.6 Sol",
      "supportedEfforts": ["none", "low", "medium", "high", "xhigh", "max"],
      "defaultEffort": "medium",
      "availability": "AVAILABLE"
    }
  ]
}
